MetaWeb Ventures,,,,TRUE,,,,,,,https://www.metaweb.vc/,https://twitter.com/MetaWebVC,@MetaWebVC,,Ecosystem Support; Funding Node,,,,,,,,NEAR,NEARCatalog,MetaWeb.VC is a global crypto firm that invests in the future of web3,website-scan: scanned
Pitchtalk,,,,TRUE,,,,,,,https://pitchtalk.com/,https://twitter.com/pitchtalk_com,@pitchtalk_com,https://t.me/pitchtalk_official,Dapp; Events; Community; Launchpad,,,,,,,,NEAR,NEARCatalog,Launchpad platform for your ideas,website-scan: scanned
LunarCrush,TRUE,,,,,,,,,,https://lunarcrush.com/,https://twitter.com/lunarcrush,@lunarcrush,https://t.me/lunarcrush,Utilities; Analytics; Social,,,Active,LunarCrush,3612,https://lunarcrush.com,name,NEAR,NEARCatalog,Invest smarter with insights from millions of conversations happening across social | Grid confirms: USDT,Grid: USDT (supported_by) | website-scan: scanned
Ready Layer One,,,,TRUE,,,,,,,https://readylayeronepodcast.com/,https://twitter.com/ready_layer_one,@ready_layer_one,,Ecosystem Support; Community,,,,,,,,NEAR,NEARCatalog,Crypto podcast that focuses on the NEAR ecosystem,website-scan: scanned
Proximity Labs,,,,TRUE,,,,,,,https://www.proximity.dev/,https://x.com/proximityfi,@proximityfi,,Ecosystem Support; Accelerator; Funding Node,,,,,,,,NEAR,NEARCatalog; AwesomeNEAR,Empowering DeFi on NEAR and Aurora,website-scan: scanned
NEAR Balkans,,,,TRUE,,,,,,,https://nearbalkans.org/,https://twitter.com/NEARbalkan,@NEARbalkan,https://t.me/nearbalkanshub,Ecosystem Support; Community; Regional Hub,,,,,,,,NEAR,NEARCatalog,The Balkans regional hub for the NEAR community,website-scan: scanned
Bitgo,TRUE,,,,,,,,,,https://www.bitgo.com/,https://x.com/BitGo,@BitGo,,Infrastructure; Custodian; Enterprise,,,Active,BitGo,1126,https://www.bitgo.com,name,NEAR,NEARCatalog; AwesomeNEAR,BitGo provides the most secure and scalable solutions for the digital asset economy; offering regulated custody; borrowing and lending; and core infrastructure to investors and builders alike | Grid confirms: USDT | (fuzzy dedup: merged from Bitgo; BitGo) | [PROMOTED from website-scan] stablecoin mentions | web3 signals (swap; liquidity; lending; staking),Grid: USDT (supported_by) | website-scan: scanned | promoted: website-scan
NEAR Tip Bot,,,,TRUE,,,,,,,https://tips.nearspace.info,https://twitter.com/NearTipbot,@NearTipbot,https://t.me/nearup_bot,Dapp; Bot,,,,,,,,NEAR,NEARCatalog; AwesomeNEAR,Building the blockchain dApp inside the messenger,website-scan: scanned
Halborn Auditing,,,,TRUE,,,,,,,https://www.halborn.com/,https://twitter.com/HalbornSecurity,@HalbornSecurity,,Ecosystem Support; Security,,,Active,Halborn,id1764913948-ySvj4s_mTS-9gQeggNdawA,https://www.halborn.com,url,NEAR,NEARCatalog,Halborn serves as your reputable partner to continuously assess an organization’s most vital assets; save time in your development lifecycle and provide world-class cybersecurity consulting and assessments every step of the way — far beyond smart contracts | [PROMOTED from website-scan] web3 signals (defi),website-scan: scanned | promoted: website-scan
Getblocks,,,,TRUE,,,,,,,https://getblock.io/,https://twitter.com/getblockio,@getblockio,https://t.me/getblockio_eng,Infrastructure; Developer Tooling; Explorer; Indexer; RPC,,,Active,GetBlock,3475,https://getblock.io,url,NEAR,NEARCatalog,Blockchain node infrastructure for building dApps,website-scan: scanned
Free Code Camp,,,,TRUE,,,,,,,https://www.freecodecamp.org/,https://twitter.com/freeCodeCamp,@freeCodeCamp,,Ecosystem Support; Education,,,,,,,,NEAR,NEARCatalog,We're a community of millions of people who are building new skills and getting new jobs together,website-scan: scanned
SubQuery,,,,TRUE,,,,,,,https://subquery.network/,https://x.com/subquerynetwork,@subquerynetwork,https://t.me/subquerynetwork,Infrastructure; Developer Tooling; Indexer,,,Active,SubQuery,id1766081108-S-8TC56RTiCYtz6KOV0sPQ,https://subquery.network,name,NEAR,NEARCatalog; AwesomeNEAR,Universal Web3 data indexing toolkit,website-scan: scanned
HAPI,,,,TRUE,,,,,,,https://hapi.one/,https://twitter.com/i_am_hapi_one,@i_am_hapi_one,https://t.me/hapiHF,Ecosystem Support; Security,,,,,,,,NEAR,NEARCatalog; CoinGecko,Onchain Cybersecurity Protocol for DeFi | Solana deployment (CoinGecko),SOL: deployed on solana (CoinGecko)
QSTN,,,,TRUE,,,,,,,https://qstn.us/,https://twitter.com/qstnus,@qstnus,https://t.me/qstnofficial,Utilities; Analytics; Community; NFT,,,,,,,,NEAR,NEARCatalog,Redefining data; DeFi and NFTs on NEAR,website-scan: scanned
Rhea Analytics,,,,TRUE,,,,,,,https://stats.ref.finance/,,,,Utilities; Analytics; DeFi,,,,,,,,NEAR,NEARCatalog,Data & Analytics on Rhea Finance,website-scan: scanned
Filebase,,,,TRUE,,,,,,,https://filebase.com/,https://twitter.com/filebase,@filebase,,Infrastructure; Storage,,,,,,,,NEAR,NEARCatalog,Store data in seconds with full S3 compatibility,website-scan: scanned
Token Terminal,TRUE,,,,,,,,,,https://tokenterminal.com/,https://x.com/tokenterminal,@tokenterminal,,Utilities; Analytics,,,Active,Token Terminal,1868,https://tokenterminal.com,name,NEAR,NEARCatalog; AwesomeNEAR,Fundamentals for crypto | Grid confirms: USDT,Grid: USDT (supported_by) | website-scan: scanned
Coreto,,,,TRUE,,,,,,,https://www.coreto.io/,https://x.com/Coretoio,@Coretoio,https://t.me/Coreto,Dapp; Social,,,,,,,,NEAR,NEARCatalog; AwesomeNEAR,Coreto pioneers trust in the digital realm through its Decentralized Reputation System (DRS); fostering transparency and authenticity while transforming online interactions,website-scan: scanned
Open Forest Protocol,,,,TRUE,,,,,,,https://www.opn-launch.com/,https://twitter.com/OpenForest_,@OpenForest_,https://t.me/openforestprotocol,Dapp; DeSci; RWA,,,,,,,,NEAR,NEARCatalog,The Open Forest Protocol is an open platform to transparently measure; verify and fund forestation projects,website-scan: scanned
NEAR Docs,,,,TRUE,,,,,,,https://docs.near.org/,,,,Utilities; Education,,,,,,,,NEAR,NEARCatalog,Starting point for all the documentations in NEAR,website-scan: scanned
Staking Rewards,TRUE,,,,,,,,,,https://www.stakingrewards.com/earn/near-protocol/,https://twitter.com/StakingRewards,@StakingRewards,https://t.me/StakingRewards,Utilities; Analytics; Explorer; Validator,,,Active,Staking Rewards,3655,https://www.stakingrewards.com,name,NEAR,NEARCatalog,Staking Explorer | Leading data provider for staking. | Grid confirms: USDT | [PROMOTED from website-scan] SOL keywords (solana),Grid: USDT (supported_by) | website-scan: scanned | promoted: website-scan
Pumpopoly.com,,,,TRUE,,,,,,,https://pumpopoly.com/,https://twitter.com/pumpopoly,@pumpopoly,,Dapp; Game; NFT,,,,,,,,NEAR,NEARCatalog,#VirtualRealEstate #CryptoGame. Passive rental income for landlords. 50% commission on invites. Join now; invite friends or be invited later. #NEAR #GameFi,website-scan: scanned
Connect3,,,,TRUE,,,,,,,https://connect3.world/,https://x.com/connect3world,@connect3world,,Dapp; Social,,,,,,,,NEAR,NEARCatalog; AwesomeNEAR,Your gateway to the fabulous Web3 world,website-scan: scanned
NEAR Nomicon,,,,TRUE,,,,,,,https://nomicon.io/,https://twitter.com/NEARProtocol,@NEARProtocol,,Other; Developer Support,,,,,,,,NEAR,NEARCatalog,The Official NEAR Protocol Specifications and Standards | [PROMOTED from website-scan] web3 signals (staking),website-scan: scanned | promoted: website-scan
DODO,TRUE,,,,TRUE,,,,,,https://dodoex.io/,https://x.com/BreederDodo,@BreederDodo,https://t.me/dodoex_official,Infrastructure; DEX,,,Active,DODO,id1753816052-RIBpiJ1EQIqCvKBWIrxCQw,https://dodoex.io,name,NEAR,NEARCatalog; AwesomeNEAR,Decentralized Trading Protocol for Web3 | Grid confirms: USDT; USDC,Grid: USDT (supported_by); USDC (supported_by) | website-scan: scanned
Astra++ DAO,,,,TRUE,,,,,,,https://app.astrodao.com/,https://x.com/NEARProtocol,@NEARProtocol,,Infrastructure; DAO,,,,,,,,NEAR,NEARCatalog,Infra to create and fund DAOs,website-scan: scanned
MATH Wallet,TRUE,,,,,,,,,,https://www.mathwallet.org,https://x.com/Mathwallet,@Mathwallet,https://t.me/mathwallet,Infrastructure; Wallet,,,Active,MathWallet,id1762175492-ITlr-uGJSQaAk3r0u0wySA,https://mathwallet.org,url,NEAR,NEARCatalog; CoinGecko; AwesomeNEAR; CoinGecko,World's First Insured Crypto Wallet | Grid confirms: USDT | Solana deployment (CoinGecko) | (fuzzy dedup: merged from MATH Wallet; Math Wallet),Grid: USDT (supported_by) | SOL: deployed on solana (CoinGecko)
My Near Wallet,TRUE,,,,,,,,,,https://mynearwallet.com/,https://x.com/MyNearWallet,@MyNearWallet,https://t.me/MyNearWallet,Infrastructure; Wallet,,,,,,,,NEAR,NEARCatalog; AwesomeNEAR,NEAR wallet to store; buy; send and stake assets for DeFi | (fuzzy dedup: merged from My Near Wallet; MyNearWallet) | [PROMOTED from website-scan] USDT keywords (usdt) | stablecoin mentions,website-scan: scanned | promoted: website-scan
Woo X,,,,TRUE,,,,,,,https://woox.io/,https://x.com/_WOO_X,@_WOO_X,https://t.me/woo_english,Other; CEX,,,,,,,,NEAR,NEARCatalog,Trade Easier with Woo | [PROMOTED from website-scan] web3 signals (liquidity; defi),website-scan: scanned | promoted: website-scan
NEAR Crowd,,,,TRUE,,,,,,,https://nearcrowd.com,https://x.com/NEARCrowd,@NEARCrowd,https://t.me/NEARCrowd,Dapp; AI,,,,,,,,NEAR,NEARCatalog; AwesomeNEAR,Earn NEAR by performing simple tasks,website-scan: scanned
Finoa,,,,TRUE,,,,,,,https://finoa.io,https://x.com/finoa_banking,@finoa_banking,,Infrastructure; Custodian,,,,,,,,NEAR,NEARCatalog; AwesomeNEAR,Empowering institutions to safely engage with crypto | [PROMOTED from website-scan] web3 signals (bridge; staking),website-scan: scanned | promoted: website-scan
DAOrecords,,,,TRUE,,,,,,,https://www.daorecords.org,https://x.com/DAOrecords_,@DAOrecords_,https://t.me/DAOrecords,Ecosystem Support; Community; Music,,,,,,,,NEAR,NEARCatalog; AwesomeNEAR,Reinventing the Record Label to Democratize the Music Industry,website-scan: scanned
DeFiLlama,TRUE,,,,TRUE,,,,,,https://defillama.com/chain/Aurora,https://x.com/DefiLlama,@DefiLlama,https://t.me/defillama_tg,Utilities; Analytics; Data Availability,,,Active,DeFiLlama,3619,https://defillama.com,name,NEAR,NEARCatalog; AwesomeNEAR,Open and transparent DeFi TVL and analytics | Grid confirms: USDT; USDC | (fuzzy dedup: merged from DeFiLlama; DefiLlama),Grid: USDT (supported_by); USDC (supported_by) | website-scan: scanned
Rainbow Bridge,TRUE,,,,,,,,,,https://rainbowbridge.app/,https://x.com/auroraisnear,@auroraisnear,,Infrastructure; Aurora; Bridge; DeFi,,,,,,,,NEAR,NEARCatalog; https://defillama.com/chain/Near; AwesomeNEAR,Transfer tokens between Ethereum; Aurora and NEAR | Supports USDC only (no USDT),USDC: $102 | website-scan: scanned
Near Social,,,,TRUE,,,,,,,https://near.social/,https://twitter.com/NearSocial_,@NearSocial_,https://t.me/NearSocial,Dapp; BOS; Social,,,,,,,,NEAR,NEARCatalog,Social data protocol on NEAR,website-scan: scanned
NEAR-STAKING,,,,TRUE,,,,,,,https://near-staking.com/,,,,Utilities; Analytics; Validator,,,,,,,,NEAR,NEARCatalog; AwesomeNEAR,See how decentralization is going on NEAR Network,website-scan: scanned
Wallet Connect,,,,,TRUE,,,,,,https://walletconnect.com/,https://x.com/WalletConnect,@WalletConnect,,Utilities; Aurora; Developer Tooling; Wallet,,,Active,WalletConnect Network,1333,https://walletconnect.com,url,NEAR,NEARCatalog,The communications protocol for Web3 | [PROMOTED from website-scan] stablecoin mentions,website-scan: scanned | promoted: website-scan
NEAR Foundation,,,,TRUE,,,,,,,https://near.foundation/,https://twitter.com/NEARFoundation,@NEARFoundation,https://t.me/cryptonear,Ecosystem Support; Funding Node,,,,,,,,NEAR,NEARCatalog,We raise awareness; support projects; and work to provide a clear path to decentralization on NEAR,website-scan: scanned
Electric Capital,,,,,TRUE,,,,,,https://electriccapital.com,https://x.com/electriccapital,@electriccapital,,Ecosystem Support; Funding Node,,,Active,Electric Capital,1849,https://www.electriccapital.com,name,NEAR,NEARCatalog; AwesomeNEAR,Crypto asset management firm | [PROMOTED from website-scan] SOL keywords (solana) | stablecoin mentions,website-scan: scanned | promoted: website-scan
Near Explorer,,,,TRUE,,,,,,,https://explorer.near.org,https://twitter.com/NearExplorer,@NearExplorer,,Infrastructure; Analytics; Explorer,,,,,,,,NEAR,NEARCatalog; AwesomeNEAR,NEAR blockchain explorer | (fuzzy dedup: merged from Near Explorer; NEAR Explorer),website-scan: scanned
Alchemy Pay,TRUE,,,,TRUE,,,,,,,,,,Utilities; On/Off-Ramp; Payment,,,Active,Alchemy Pay,id1753462300-6vw16vujRcOnHVhHbymdXw,https://alchemypay.org,name,NEAR,NEARCatalog,Hybrid crypto-fiat payment solutions | Grid confirms: USDT; USDC; SOL,Grid: USDT (supported_by); USDC (supported_by); SOL (supported_by)
Aurigami,,,,TRUE,,,,,,,au,https://x.com/aurigami_PLY,@aurigami_PLY,,Dapp; Aurora; Borrowing / Lending; DeFi,,,,,,,,NEAR,NEARCatalog; AwesomeNEAR,Lend; borrow; and earn with ease on Aurora | Grid match cleared (false positive: matched Aurory),website-scan: scanned
Coin98 Wallet,,,,TRUE,,,,,,,https://coin98.app,https://x.com/coin98_wallet,@coin98_wallet,https://t.me/coin98_wallet,Infrastructure; Mobile; Wallet,,,,,,,,NEAR,NEARCatalog; CoinGecko; AwesomeNEAR; CoinGecko,Using a Decentralized Wallet With Experiences of a Centralized One | Solana deployment (CoinGecko),SOL: deployed on solana (CoinGecko)
Trust Wallet,TRUE,,,,TRUE,,,,,,https://trustwallet.com/,https://x.com/TrustWallet,@TrustWallet,https://t.me/trust_announcements,Infrastructure; NEAR Intents; Wallet,,,Active,Trust Wallet,50,https://trustwallet.com,name,NEAR,NEARCatalog; AwesomeNEAR,Fast and secure Ethereum wallet that’s easy to use | Grid confirms: USDT; USDC; SOL,Grid: USDT (supported_by); USDC (supported_by); SOL (supported_by) | website-scan: scanned
NEAR Examples,,,,TRUE,,,,,,,https://examples.near.org/,https://twitter.com/nearprotocol,@nearprotocol,https://t.me/neardev,Utilities; Developer Tooling; Education,,,,,,,,NEAR,NEARCatalog,Check out these examples for inspiration!,website-scan: scanned
MetaMask,TRUE,,,,TRUE,,,,,,https://metamask.io/,https://x.com/MetaMask,@MetaMask,,Infrastructure; Wallet,,,Active,MetaMask,id1749490788-URjjR1kORQK3qw9sDJQGyA,https://metamask.io,name,NEAR,NEARCatalog; AwesomeNEAR,A crypto wallet & gateway to blockchain apps | Grid confirms: USDT; USDC | [PROMOTED from website-scan] USDC keywords (usdc) | SOL keywords (solana),Grid: USDT (supported_by); USDC (supported_by) | website-scan: scanned | promoted: website-scan
IPFS,,,,TRUE,,,,,,,https://ipfs.io,https://x.com/IPFS,@IPFS,,Infrastructure; Developer Tooling; Storage,,,,,,,,NEAR,NEARCatalog; AwesomeNEAR,A peer-to-peer hypermedia protocol to make the web faster; safer; and more open | [PROMOTED from website-scan] web3 signals (bridge),website-scan: scanned | promoted: website-scan
NEAR Protocol,,,,TRUE,,,,,,,https://near.org/,https://x.com/nearprotocol,@nearprotocol,https://t.me/cryptonear,Infrastructure; BOS; Chain Abstraction; Data Availability; Security; Validator,,,Active,NEAR Protocol,id1751128320-Hy7-rDk-TeenVKccZmQSPQ,https://www.near.org,name,NEAR,NEARCatalog; AwesomeNEAR,The highly scalable; developer-friendly blockchain | [PROMOTED from website-scan] web3 signals (bridge),website-scan: scanned | promoted: website-scan
Graph,TRUE,,,,,,,,,,https://thegraph.com/,https://twitter.com/graphprotocol,@graphprotocol,https://t.me/graphprotocol,Utilities; Developer Tooling; Indexer,,,Active,Graph,id1757910001-WPX0wBbTR-GjVovGp2ZfBA,https://graph.finance,name,NEAR,NEARCatalog,The Graph is a web3 protocol for organizing and accessing blockchain data | Grid confirms: USDC | [PROMOTED from website-scan] web3 signals (defi),Grid: USDC (supported_by) | website-scan: scanned | promoted: website-scan
Circle USYC,TRUE,,,,,,,,,,https://www.circle.com/usyc,https://x.com/circle,@circle,,RWA,,,,,,,,BSC; Ethereum; Near; Noble,https://defillama.com/chain/Near; CoinGecko,Solana deployment (CoinGecko),SOL: deployed on solana (CoinGecko)
Allstake,,,,TRUE,,,,,,,https://allstake.org/,https://x.com/allstake_fi,@allstake_fi,,Restaking,,,,,,,,Near; Solana; Ethereum,https://defillama.com/chain/Near,[PROMOTED from website-scan] web3 signals (staking),website-scan: scanned | promoted: website-scan
HERE Wallet staking,TRUE,,,,,,,,,,https://herewallet.app/stake,https://x.com/here_wallet,@here_wallet,,Liquid Staking,,,,,,,,Near,https://defillama.com/chain/Near,[PROMOTED from website-scan] USDT keywords (usdt) | USDC keywords (usdc) | stablecoin mentions,website-scan: scanned | promoted: website-scan
Jumbo Exchange,TRUE,,,,TRUE,,,,,,https://jumbo.exchange/,https://x.com/jumbo_exchange,@jumbo_exchange,https://t.me/jumbo_ann,Dexs,,,,,,,,Near,https://defillama.com/chain/Near; AwesomeNEAR,Supports USDT + USDC,USDT: $3;398 | USDC: $39 | website-scan: scanned
TruFin Protocol,TRUE,,,,,,,,,,,,,,Liquid Staking,,,,,,,,Aptos; Ethereum; Injective; Solana; Near,https://defillama.com/chain/Near,,
Spin,TRUE,,,,TRUE,,,,,,https://spin.fi/,https://x.com/spin_fi,@spin_fi,https://t.me/spin_fi,DAPPS; DEFI; DEX; EXCHANGES,,,,,,,,NEAR,https://defillama.com/chain/Near; AwesomeNEAR,DeFi derivatives infrastructure built on NEAR Protocol | Grid match cleared (false positive: matched Degen Spin) | Supports USDT + USDC | [PROMOTED from website-scan] USDC keywords (usdc) | stablecoin mentions,USDT: $1;355 | USDC: $16;943 | website-scan: scanned | promoted: website-scan
Tonic,TRUE,,,,TRUE,,,,,,,https://x.com/tonicdex,@tonicdex,,Dexs,,,,,,,,Near,https://defillama.com/chain/Near,Supports USDT + USDC,USDT: $5;760 | USDC: $10;473
Roketo,TRUE,,,,TRUE,,,,,,https://www.roke.to/,https://x.com/roketostream,@roketostream,https://t.me/roketochat,Payments,,,,,,,,Near,https://defillama.com/chain/Near; AwesomeNEAR,Supports USDT + USDC,USDT: $3;934 | USDC: $1;229 | website-scan: scanned
OIN Finance,,,,TRUE,,,,,,,https://oin.finance/,https://x.com/FinanceOin,@FinanceOin,https://t.me/OIN_Finance_Eng,DAPPS; DEFI; STABLECOINS,,,,,,,,NEAR,https://defillama.com/chain/Near; AwesomeNEAR,The Gateway to DeFi | (fuzzy dedup: merged from Oin Finance; OIN Finance),website-scan: scanned
LazyFi,TRUE,,,,,,,,,,,https://x.com/LazyFi_Learning,@LazyFi_Learning,,Gaming,,,,,,,,Near,https://defillama.com/chain/Near,Supports USDC only (no USDT),USDC: $0
Nearlend DAO,TRUE,,,TRUE,,,,,,,https://nearlenddao.com/,https://x.com/NearlendDao,@NearlendDao,https://t.me/+gYhnDfknkRdhMjQ1,Lending,,,,,,,,Near,https://defillama.com/chain/Near; AwesomeNEAR,Open-Source Capital Market on NEAR,website-scan: scanned
Stader,TRUE,,,TRUE,,,,,,,https://staderlabs.com/,https://x.com/stader__near,@stader__near,https://t.me/staderlabs,Liquid Staking,,,,,,,,Ethereum; Hedera; BSC; Fantom; Terra2; Near,https://defillama.com/chain/Near; CoinGecko; AwesomeNEAR; CoinGecko,Solana deployment (CoinGecko),SOL: deployed on solana (CoinGecko)
Portal,TRUE,,,,TRUE,,,,,,https://www.portalbridge.com/,https://x.com/portalbridge_,@portalbridge_,,Bridge,,,Acquired,Portal,id1755264746-oaY4ihT_Qayd7F9reADEHQ,https://www.portalhq.io,name,Ethereum; Solana; BSC; Polygon; Terra Classic; Near; Avalanche; Arbitrum; Fantom; Sui; Aptos; Moonbeam; Base; Algorand; Kaia; Celo; OP Mainnet; Oasis Emerald; Aurora; Injective; Terra2; XPLA; Acala; Karura; Berachain; Hyperliquid L1; Ink; Linea; Mantle; Mezo; Plume Mainnet; Scroll; Sonic; Unichain; World Chain; XRPL EVM; Monad,https://defillama.com/chain/Near; CoinGecko; AwesomeNEAR; CoinGecko,Grid confirms: USDT; USDC | Solana deployment (CoinGecko),Grid: USDT (supported_by); USDC (supported_by) | SOL: deployed on solana (CoinGecko)
PembRock Finance,TRUE,,,TRUE,,,,,,,https://pembrock.finance/,https://x.com/PembrockFi,@PembrockFi,https://t.me/pembrock_finance,Yield,,,,,,,,Near,https://defillama.com/chain/Near; AwesomeNEAR,Leveraged yield farming on NEAR,website-scan: scanned
Houdini Swap,TRUE,,,,TRUE,,,,,,,,,,DEX Aggregator,,,Active,Houdini Swap,id1761945720-t-MHcpaITCqtXg68z4Mrmw,https://houdiniswap.com,name,Ethereum; Bitcoin; BSC; Arbitrum; Avalanche; Cardano; Cronos; Polygon; Solana; Tron; Fantom; Litecoin; Base; OP Mainnet; Celo; Aurora; Moonbeam; Moonriver; Hedera; Algorand; Telos; Thorchain; Aptos; Phantasma; TON; Sui; ICP; Linea; Mantle; Near; Scroll; Taiko; zkLink Nova; Sonic; Hyperliquid L1; Berachain; IOTA EVM; Hemi,https://defillama.com/chain/Near; CoinGecko,Grid confirms: USDT; USDC; SOL | Solana deployment (CoinGecko),Grid: USDT (supported_by); USDC (supported_by); SOL (supported_by) | SOL: deployed on solana (CoinGecko)
Octopus Network,,,,TRUE,,,,,,,https://oct.network,https://x.com/oct_network,@oct_network,,DEVTOOLING; INFRASTRUCTURE; OCTOPUS,,,,,,,,NEAR,https://defillama.com/chain/Near; AwesomeNEAR,A multi-chain network providing leased security and interoperability to Substrate appchains,website-scan: scanned
MITTE,,,,TRUE,,,,,,,,,,,NftFi,,,,,,,,Near,https://defillama.com/chain/Near,,
TeleSwap TON,,,,TRUE,,,,,,,,,,,Bridge Aggregator,,,,,,,,Bitcoin; Ethereum; Sui; Tron; Base; BSC; Taraxa; Avalanche; Litecoin; Arbitrum; Near; Polygon; TON; Solana,https://defillama.com/chain/Near,,
MoreMarkets.xyz,TRUE,,,,,,,,,,https://www.moremarkets.xyz/,https://x.com/moremarketsxyz,@moremarketsxyz,,Yield,,,,,,,,Ethereum; XRPL; Flare; Near,https://defillama.com/chain/Near,[PROMOTED from website-scan] web3 signals (yield; staking; defi),website-scan: scanned | promoted: website-scan
THORSwap,,,,TRUE,,,,,,,,,,,DEX Aggregator,,,,,,,,Ethereum; Thorchain; Near; Mayachain; Chainflip,https://defillama.com/chain/Near,,
Allbridge,TRUE,,,,TRUE,,,,,,https://allbridge.io/,https://x.com/Allbridge_io,@Allbridge_io,https://t.me/allbridge_official,Bridge,,,Active,Allbridge,64,https://allbridge.io,name,Ethereum; Solana; Polygon; BSC; Avalanche; Near; Celo; Fantom; Terra Classic; XRPL; Aurora; Harmony; Fuse; Heco; Tezos; Kaia; Waves; Stellar; Stacks,https://defillama.com/chain/Near; AwesomeNEAR,Grid confirms: USDT; USDC | [PROMOTED from website-scan] USDT keywords (usdt) | stablecoin mentions,Grid: USDT (supported_by); USDC (supported_by) | website-scan: scanned | promoted: website-scan
Orderly,TRUE,,,,TRUE,,,,,,https://orderly.network,https://x.com/OrderlyNetwork,@OrderlyNetwork,,,,,Active,Orderly Network,id1759189372-BQsgqZmkReCR2bIUGoHlUA,https://orderly.network,name,Solana; Arbitrum; Abstract; Ethereum; BSC; Berachain; Near; OP Mainnet; Story; Sei; Base; Mode; Polygon; Avalanche; Sonic; Mantle; Plume (Deprecated); Morph,https://defillama.com/chain/Near; CoinGecko,Supports USDT + USDC | Grid confirms: USDT; USDC; SOL | Solana deployment (CoinGecko),USDT: $27;348 | USDC: $181;492 | Grid: USDT (supported_by); USDC (supported_by); SOL (supported_by) | SOL: deployed on solana (CoinGecko)
NEAR Wallet,,,,TRUE,,,,,,,https://wallet.near.org/,,,,INFRASTRUCTURE; WALLETS,,,,,,,,NEAR,AwesomeNEAR,Web wallet for NEAR Protocol which stores keys in browser's localStorage,website-scan: scanned
Ref Finance,,,,TRUE,,,,,,,https://ref.finance,https://x.com/finance_ref,@finance_ref,https://t.me/ref_finance,AURORA; DAPPS; DEFI; EXCHANGES,,,,,,,,NEAR,AwesomeNEAR,Multi-purpose DeFi platform built on NEAR Protocol,website-scan: scanned
Open Web Collective,,,,TRUE,,,,,,,https://openwebcollective.com/,https://x.com/openwebfounders,@openwebfounders,,ECOSYSTEM; FUNDING,,,,,,,,NEAR,AwesomeNEAR,Build the Open Web; Unlock the Future,website-scan: scanned
HASH RUSH,,,,TRUE,,,,,,,https://hashrush.com/,https://x.com/PlayHashRush,@PlayHashRush,https://t.me/hashrushofficial,DAPPS; GAMING; OWC; NFT,,,,,,,,NEAR,AwesomeNEAR,Online sci-fi/fantasy RTS set in the fictional Hermeian galaxy,website-scan: scanned
D1 Ventures,,,,TRUE,,,,,,,https://d1.ventures/,https://x.com/d1ventures,@d1ventures,,ECOSYSTEM; FUNDING; INFRASTRUCTURE; VALIDATORS,,,,,,,,NEAR,AwesomeNEAR,Powering the future of open economy,website-scan: scanned
The Graph,,,,TRUE,,,,,,,https://thegraph.com,https://x.com/graphprotocol,@graphprotocol,http://t.me/graphprotocol,AURORA; DATA; DEVTOOLING,,,Active,The Graph,1851,https://thegraph.com,name,NEAR,AwesomeNEAR,Scalable Queries for a Decentralized Future | [PROMOTED from website-scan] web3 signals (defi),website-scan: scanned | promoted: website-scan
Paras,,,,TRUE,,,,,,,https://paras.id,https://x.com/ParasHQ,@ParasHQ,https://t.me/parashq,DAPPS; MARKETPLACES; NFT; OWC,,,,,,,,NEAR,AwesomeNEAR,Create; Trade; and Collect Digital Collectibles,website-scan: scanned
NEARFans,,,,TRUE,,,,,,,https://nearfans.com/,,,,DAO; ECOSYSTEM; VALIDATORS,,,,,,,,NEAR,AwesomeNEAR,NEARFans is created by a group of NEAR builders,website-scan: scanned
Burrow,,,,TRUE,,,,,,,https://burrow.cash/,https://x.com/burrowcash,@burrowcash,https://t.me/burrowcash,DAPPS; DEFI; LENDING,,,,,,,,NEAR,AwesomeNEAR,Borrow; Supply. Thrive,website-scan: scanned
NEAR University,,,,TRUE,,,,,,,https://www.near.university/,https://x.com/NEARUniversity,@NEARUniversity,,EDUCATION; ECOSYSTEM,,,,,,,,NEAR,AwesomeNEAR,Learn; earn; connect and certify in the NEAR community,website-scan: scanned
Snark.Art,,,,TRUE,,,,,,,https://snark.art,https://x.com/snarkdotart,@snarkdotart,https://t.me/snarkdotart,DAPPS; NFT; OWC,,,,,,,,NEAR,AwesomeNEAR,Blockchain laboratory exploring creative & commercial possibilities in art,website-scan: scanned
Machina,,,,TRUE,,,,,,,https://machina.storage/,https://x.com/machina_storage,@machina_storage,https://t.me/machina_group,INFRASTRUCTURE; STORAGE; DEVTOOLING; AURORA,,,,,,,,NEAR,AwesomeNEAR,Sharded data storage structure,website-scan: scanned
Pad.Fi,,,,TRUE,,,,,,,https://pad.fi/,https://x.com/NearPAD,@NearPAD,https://t.me/nearpad,AURORA; DAPPS; DEFI; EXCHANGES; LAUNCHPADS,,,,,,,,NEAR,AwesomeNEAR,NearPad. Launchpad & DeFi hub for the NEAR ecosystem,website-scan: scanned
KYVE,,,,TRUE,,,,,,,https://www.kyve.network/,https://x.com/KYVENetwork,@KYVENetwork,https://t.me/kyvenet,DEVTOOLING; INFRASTRUCTURE; STORAGE,,,,,,,,NEAR,AwesomeNEAR,Enabling limitless scalability for Web3,website-scan: scanned
GoNearName,,,,TRUE,,,,,,,https://gonear.name/,,,,DAPPS; IDENTITY,,,,,,,,NEAR,AwesomeNEAR,NEAR Account Marketplace - Sell; Bid and Buy NEAR Account Names,website-scan: scanned
