OpenBiSea,FALSE,FALSE,FALSE,FALSE,FALSE,FALSE,FALSE,FALSE,FALSE,Not Processed,https://openbisea.io/,,https://twitter.com/openbisea,,DEX,,,❌ Not found,,,,,kava,https://www.kava.io/ecosystem,Easily navigate the Metaverse and associated marketplaces to explore content and to buy or sell NFT tokens.,
PhotonSwap,FALSE,FALSE,FALSE,FALSE,FALSE,FALSE,FALSE,FALSE,FALSE,Not Processed,https://www.photonswap.finance/#/swap,,https://twitter.com/photonswap_fi,,DEX,,,❌ Not found,,,,,kava,https://www.kava.io/ecosystem,AMM styled decentralized exchange (DEX) on Cronos.,
Pinjam,FALSE,FALSE,FALSE,FALSE,FALSE,FALSE,FALSE,FALSE,FALSE,Not Processed,https://pinjamlabs.com/,,https://twitter.com/PinjamLabs,,Lending,,,❌ Not found,,,,,kava,https://www.kava.io/ecosystem,Pinjam is a non-custodial liquidity market.,
Project Zero,FALSE,FALSE,FALSE,FALSE,FALSE,FALSE,FALSE,FALSE,FALSE,Not Processed,http://projectzero.io/,,https://x.com/ProjectZeroIO,,,,,❌ Not found,,,,,kava,https://www.kava.io/ecosystem,Project Zero lets dApps & AI Agents to work across blockchains; transforming on-chain data into actionable insights & real-time decisions.,
Pyth Network,FALSE,FALSE,FALSE,FALSE,FALSE,FALSE,FALSE,FALSE,FALSE,Added,https://pyth.network/,,https://twitter.com/PythNetwork,,,,,✅ Found,Pyth Network,93,https://admin.thegrid.id/profiles/?rootId=93,URL: urlMain,kava,https://www.kava.io/ecosystem,The Pyth Network is a first-party financial data oracle network that delivers low-latency price data for various assets to blockchains secur,
RedStone Oracle,FALSE,FALSE,FALSE,FALSE,FALSE,FALSE,FALSE,FALSE,FALSE,Added,https://redstone.finance/,,https://x.com/redstone_defi,,Infrastructure,,,✅ Found,RedStone Finance,id1759411240-Lx0gj17CTLGBQ2B-qGOB1g,https://admin.thegrid.id/profiles/?rootId=id1759411240-Lx0gj17CTLGBQ2B-qGOB1g,URL: urlMain,kava,https://www.kava.io/ecosystem,Modular Oracle that delivers exactly the data feeds you need (e.g. LSTs); tailored to the protocol’s requirements.,
Router Protocol,FALSE,FALSE,FALSE,FALSE,FALSE,FALSE,FALSE,FALSE,FALSE,Added,https://www.routerprotocol.com/,,https://twitter.com/routerprotocol,,Cross-Chain,,,✅ Found,Router Protocol,id1762785155-fFxMQQaUQdOTDrzwhd3--Q,https://admin.thegrid.id/profiles/?rootId=id1762785155-fFxMQQaUQdOTDrzwhd3--Q,Name: Profile,kava,https://www.kava.io/ecosystem,Infrastructure layer enabling communication between blockchains.,
Saddle Finance,FALSE,FALSE,FALSE,FALSE,FALSE,FALSE,FALSE,FALSE,FALSE,Not Processed,https://saddle.finance/,,https://twitter.com/saddlefinance,,DEX,,,❌ Not found,,,,,kava,https://www.kava.io/ecosystem,Saddle is an automated market maker for pegged value crypto assets.,
Selfex,FALSE,FALSE,FALSE,FALSE,FALSE,FALSE,FALSE,FALSE,FALSE,Not Processed,https://app.selfex.app/,,https://www.kava.io/ecosystem?page=2#submit-project,,DEX,,,❌ Not found,,,,,kava,https://www.kava.io/ecosystem,Selfex is A BlockChain-Decentralized Exchange & Forex. Selfex is a KAVA chain StableSwap DEX & Forex Market.,
Stakerz,FALSE,FALSE,FALSE,FALSE,FALSE,FALSE,FALSE,FALSE,FALSE,Not Processed,https://app.stakerz.io/,,https://twitter.com/stakerz_io,,Yield,,,❌ Not found,,,,,kava,https://www.kava.io/ecosystem,Stakerz is a Decentralized; Multichain Yield Optimizer platform.,
Stipend,FALSE,FALSE,FALSE,FALSE,FALSE,FALSE,FALSE,FALSE,FALSE,Not Processed,https://governordao.org/,,https://twitter.com/Governor_DAO,,Yield,,,❌ Not found,,,,,kava,https://www.kava.io/ecosystem,Governor DAO presents Stipend - a gamified; PVP staking app designed to facilitate Universal Basic Income.,
Supra Oracle,FALSE,FALSE,FALSE,FALSE,FALSE,FALSE,FALSE,FALSE,FALSE,Not Processed,https://supraoracles.com/,,https://twitter.com/SupraOracles,,Infrastructure,,,❌ Not found,,,,,kava,https://www.kava.io/ecosystem,Bridging real-world data to simplify and secure the smart contracts of financial markets.,
Surfswap,FALSE,FALSE,FALSE,FALSE,FALSE,FALSE,FALSE,FALSE,FALSE,Not Processed,https://surfdex.io/,,https://twitter.com/SurfswapDEX,,DEX,,,❌ Not found,,,,,kava,https://www.kava.io/ecosystem,One-stop shop for the crypto community; enabling peer-to-peer transactions.,
Tarot,FALSE,FALSE,FALSE,FALSE,FALSE,FALSE,FALSE,FALSE,FALSE,Not Processed,https://www.tarot.to/,,https://twitter.com/TarotFinance,,Lending,,,❌ Not found,,,,,kava,https://www.kava.io/ecosystem,Protocol users can deposit LP tokens in Tarot Vaults and receive Vault Tokens.,
Team Finance,FALSE,FALSE,FALSE,FALSE,FALSE,FALSE,FALSE,FALSE,FALSE,Not Processed,https://www.team.finance/,,https://twitter.com/TeamFinance_,,Launchpad,,,❌ Not found,,,,,kava,https://www.kava.io/ecosystem,TeamFinance gives you the toolkit to help create and grow a successful token.,
Tether,FALSE,FALSE,FALSE,FALSE,FALSE,FALSE,FALSE,FALSE,FALSE,Added,https://tether.to/en/,,https://twitter.com/Tether_to/,,Stablecoins,,,✅ Found,Tether,1275,https://admin.thegrid.id/profiles/?rootId=1275,Name: Profile,kava,https://www.kava.io/ecosystem,Tether’s USDT; the world’s most liquid; secure and transparent stablecoin; has successfully launched on Cosmos via Kava.,
Trust Wallet,FALSE,FALSE,FALSE,FALSE,FALSE,FALSE,FALSE,FALSE,FALSE,Added,https://trustwallet.com/kava-wallet/,,https://twitter.com/trustwallet,,Wallet,,,✅ Found,Trust Wallet,50,https://admin.thegrid.id/profiles/?rootId=50,Social Handle: Socials Lens - Twitter / X,kava,https://www.kava.io/ecosystem,The most trusted & secure crypto wallet. Buy; store; collect NFTs; stake; exchange & earn crypto.,
UnoRe,FALSE,FALSE,FALSE,FALSE,FALSE,FALSE,FALSE,FALSE,FALSE,Not Processed,https://unore.io/,,https://twitter.com/unoreinsure,,Insurance,,,❌ Not found,,,,,kava,https://www.kava.io/ecosystem,Insuring your DeFi journey.,
Upbit,FALSE,FALSE,FALSE,FALSE,FALSE,FALSE,FALSE,FALSE,FALSE,Added,https://t.co/Skv1S4YPWQ,,https://twitter.com/upbitglobal,,Exchange,,,✅ Found,Upbit,id1755593167-MCyxb005SMqwfvcA7zCVaQ,https://admin.thegrid.id/profiles/?rootId=id1755593167-MCyxb005SMqwfvcA7zCVaQ,Name: Profile,kava,https://www.kava.io/ecosystem,Fast and convenient trading experience on PC web and mobile apps for professional investors.,
WOWswap,FALSE,FALSE,FALSE,FALSE,FALSE,FALSE,FALSE,FALSE,FALSE,Not Processed,https://wowswap.io/,,https://twitter.com/Wowswap_io,,DEX,,,❌ Not found,,,,,kava,https://www.kava.io/ecosystem,WOWswap is a decentralized leveraged trading protocol.,
Weld,FALSE,FALSE,FALSE,FALSE,FALSE,FALSE,FALSE,FALSE,FALSE,Not Processed,https://weld.finance/,,https://twitter.com/KnitFinance,,Farm,,,❌ Not found,,,,,kava,https://www.kava.io/ecosystem,Liquid stacking protocol for all the assets produced by Knit finance and some other generic assets.,
Witnet,FALSE,FALSE,FALSE,FALSE,FALSE,FALSE,FALSE,FALSE,FALSE,Added,https://witnet.io/,,https://twitter.com/witnet_io,,Infrastructure,,,✅ Found,Witnet,id1766094723-4xFlZLOkTBi_RPrOUzfwBw,https://admin.thegrid.id/profiles/?rootId=id1766094723-4xFlZLOkTBi_RPrOUzfwBw,URL: urlMain,kava,https://www.kava.io/ecosystem,Witnet enables your smart contracts to react to real world events with strong crypto-economic guarantees.,
XT.com Exchange,FALSE,FALSE,FALSE,FALSE,FALSE,FALSE,FALSE,FALSE,FALSE,Not Processed,https://t.co/UaM9QD7sYI,,https://twitter.com/XTexchange,,,,,❌ Not found,,,,,kava,https://www.kava.io/ecosystem,he World's First Social Infused Exchange.,
ZB,FALSE,FALSE,FALSE,FALSE,FALSE,FALSE,FALSE,FALSE,FALSE,Not Processed,https://m.zb.com/en/,,https://mobile.twitter.com/zbexchange,,Exchange,,,❌ Not found,,,,,kava,https://www.kava.io/ecosystem,ZB Exchange is a reliable digital assets exchange and cryptocurrency trading network.,
dForce,FALSE,FALSE,FALSE,FALSE,FALSE,FALSE,FALSE,FALSE,FALSE,Not Processed,https://dforce.network/,,https://twitter.com/dForcenet,,Lending,,,❌ Not found,,,,,kava,https://www.kava.io/ecosystem,dForce network is an ecosystem of protocols aiming to be a full stack solution for DeFi.,
